{"$id":"https://vault-agent-memory.invalid/subject-distillation/task-authorization-v2.schema.json","$schema":"https://json-schema.org/draft/2020-12/schema","additionalProperties":false,"properties":{"allowed_repo_relative_paths":{"items":{"type":"string"},"maxItems":64,"minItems":1,"type":"array"},"artifact_kind":{"const":"subject-task-implementation-authorization-proof","type":"string"},"authorization_id":{"pattern":"^[0-9a-f]{64}$","type":"string"},"authorization_runner_v1_sha256":{"pattern":"^[0-9a-f]{64}$","type":"string"},"authorization_runner_v2_sha256":{"pattern":"^[0-9a-f]{64}$","type":"string"},"authorization_schema_sha256":{"pattern":"^[0-9a-f]{64}$","type":"string"},"authorization_verifier_sha256":{"pattern":"^[0-9a-f]{64}$","type":"string"},"authorized_task":{"pattern":"^T-[0-9]{3}$","type":"string"},"authorizing_principal":{"const":"github:zycaskevin","type":"string"},"baseline_full_digest":{"pattern":"^[0-9a-f]{64}$","type":"string"},"baseline_id":{"pattern":"^[0-9a-f]{16}$","type":"string"},"expires_at_utc":{"type":"string"},"implementation_base_commit":{"pattern":"^git:(?:[0-9a-f]{40}|[0-9a-f]{64})$","type":"string"},"issued_at_utc":{"type":"string"},"non_goals":{"items":{"type":"string"},"maxItems":16,"minItems":1,"type":"array"},"owner_confirmation_ref":{"pattern":"^[A-Za-z0-9][A-Za-z0-9._:-]{0,127}$","type":"string"},"progress_sequence":{"minimum":1,"type":"integer"},"progress_sha256":{"pattern":"^[0-9a-f]{64}$","type":"string"},"proof_repo_relative_path":{"type":"string"},"proposal_id":{"pattern":"^[0-9a-f]{64}$","type":"string"},"protocol_contract_sha256":{"pattern":"^[0-9a-f]{64}$","type":"string"},"protocol_decision_id":{"const":"SD-TASK-AUTH-V2-BRIDGE","type":"string"},"prohibited_operations":{"items":{"type":"string"},"maxItems":16,"minItems":1,"type":"array"},"receipt_sha256":{"pattern":"^[0-9a-f]{64}$","type":"string"},"recorded_at_utc":{"type":"string"},"schema_version":{"const":2,"type":"integer"},"scope_descriptor_path":{"type":"string"},"scope_descriptor_sha256":{"pattern":"^[0-9a-f]{64}$","type":"string"},"scope_sha256":{"pattern":"^[0-9a-f]{64}$","type":"string"},"status":{"const":"PASS","type":"string"},"task_authorization_schema_sha256":{"pattern":"^[0-9a-f]{64}$","type":"string"},"task_authorization_validator_sha256":{"pattern":"^[0-9a-f]{64}$","type":"string"},"task_progress_updater_v2_sha256":{"pattern":"^[0-9a-f]{64}$","type":"string"}},"required":["schema_version","artifact_kind","status","protocol_decision_id","protocol_contract_sha256","authorized_task","implementation_base_commit","baseline_id","baseline_full_digest","authorizing_principal","allowed_repo_relative_paths","non_goals","prohibited_operations","issued_at_utc","expires_at_utc","recorded_at_utc","scope_descriptor_path","scope_descriptor_sha256","progress_sequence","progress_sha256","receipt_sha256","scope_sha256","authorization_verifier_sha256","authorization_schema_sha256","authorization_id","proposal_id","authorization_runner_v1_sha256","authorization_runner_v2_sha256","task_authorization_schema_sha256","task_authorization_validator_sha256","task_progress_updater_v2_sha256","owner_confirmation_ref","proof_repo_relative_path"],"type":"object"}
