{"allowed_repo_relative_paths":["specs/subject-distillation/.implementation-progress.pending","specs/subject-distillation/.task-authorization.pending","specs/subject-distillation/implementation-progress.json","specs/subject-distillation/task-authorizations/T-002.json","specs/subject-distillation/task-authorizations/T-002.review.json","tests/fixtures/subject_distillation/fragments/failure-boundary-cases.json","tests/fixtures/subject_distillation/manifest.json","tests/fixtures/subject_distillation/migration/migration-boundary-cases.json","tests/fixtures/subject_distillation/organization/authority-boundary-cases.json","tests/fixtures/subject_distillation/person/person-cases.json","tests/test_subject_fixture_privacy.py"],"artifact_kind":"subject-task-implementation-authorization-proof","authorization_id":"6fea50fb517ff73ca37e88fc56bfd6ca89b4a2d7bf44e73e62ec93d5788bce74","authorization_runner_v1_sha256":"51ebcc00958c77d07cb7249070b91c17b5bb25fa6ed4737379514c7aa01db2c9","authorization_runner_v2_sha256":"4f5bbcb87d17fde09075c5939584b881c2082b001cfbd97c3144b77ce4363c49","authorization_schema_sha256":"73ebc733f482a06b4ba77e507869597a2bc0b5e3ba6eca3ca969d7796d6170fe","authorization_verifier_sha256":"fd233f32a5f7afe506276fc92aae0d77a6144a0537e8b9b8f25cf300b22cdbe3","authorized_task":"T-002","authorizing_principal":"github:zycaskevin","baseline_full_digest":"0dc10cfc4a429662037f3bb7d6c42e10e7cc832b540f7aa8f4b9e0656e0e459b","baseline_id":"0dc10cfc4a429662","expires_at_utc":"2026-08-12T01:51:41Z","implementation_base_commit":"git:8472adc35c01a8269426cf6db04da01b1cbbcb68","issued_at_utc":"2026-08-12T01:36:41Z","non_goals":["no.live.private.data","no.t003.plus.artifact","no_product_runtime","no_production_migration"],"owner_confirmation_ref":"owner-message:t002-confirmation-20260812-0136","progress_sequence":2,"progress_sha256":"ab723c1adde2739f54deba7fee85d86a95002f167703354695503363154d30e6","prohibited_operations":["deploy","live_private_data","migration","non_github_remote_network","product_runtime","release","unreviewed_git_delivery"],"proof_repo_relative_path":"specs/subject-distillation/task-authorizations/T-002.json","proposal_id":"04dacf871f27d84d948d6821d4fa946e7788d786c6d247c879cb65e0cc111f97","protocol_contract_sha256":"6a8c0d49848a768f12b5deea26a8552cfc4a376814489804962c01ae33389e9d","protocol_decision_id":"SD-TASK-AUTH-V2-BRIDGE","receipt_sha256":"e2c598d323b8d3bd5071059a2b04f3be3da0954fac2201f465481495a15734a0","recorded_at_utc":"2026-08-12T01:40:19Z","schema_version":2,"scope_descriptor_path":"specs/subject-distillation/task-scopes/T-002.json","scope_descriptor_sha256":"e771bc5d09d74e12a47195427604e3889f8b8ee44cfdc3778f77ddac0a8f3982","scope_sha256":"e95c2f82f68ff0a63c4d684f1ab0a6a9578ac629d1ae74fb13cd77a1a6efb579","status":"PASS","task_authorization_schema_sha256":"5de3c8a69a6c8339cab74c17e1f76b08dec2a350786536583d52c230143ed448","task_authorization_validator_sha256":"aa209054229f4dba4067a9fd8df301b1f1455da396dc9c2c5ccb2547325cc0ba","task_progress_updater_v2_sha256":"eacb790b748e7abccc9b88d8376d5bea57c11a4e93efabaa517441f26d5f3e66"}
